{
  "$schema": "https://json-schema.org/draft/2020-12/schema",
  "$id": "https://q2d.dev/conformance/vector.schema.json",
  "title": "Q2D conformance vector (authored form)",
  "description": "The authored vector, carrying both halves. P-001 §4.4 defines the format; this schema is its machine-checkable statement. The input-only projection a runner receives is P-001 §4.2 and P-001 issue 2 — implementations never see a file matching this schema.",
  "type": "object",
  "additionalProperties": false,
  "required": ["id", "section", "requirement", "description", "operation", "input", "expect"],
  "properties": {
    "id": {
      "description": "Stable identifier, lowercase kebab segments separated by '/'. The first segment repeats 'section'; the harness checks the two agree and that the file sits under a directory of that name.",
      "type": "string",
      "pattern": "^[a-z0-9]+(-[a-z0-9]+)*(/[a-z0-9]+(-[a-z0-9]+)*)+$"
    },
    "section": {
      "description": "Corpus section. Closed, and extended additively by the PRD that owns the new section — the same discipline P-001 §4.5 applies to the operation vocabulary, and for the same reason: a typo must not create a section.",
      "type": "string",
      "enum": [
        "message",
        "suite",
        "replay",
        "registry",
        "domain",
        "policy",
        "budget",
        "denial",
        "ordering",
        "evaluate",
        "validate",
        "pipeline",
        "receipt",
        "requester",
        "binding",
        "identity",
        "escalation",
        "demo",
        "adversarial"
      ]
    },
    "requirement": {
      "description": "What this vector exercises. Mandatory with no default: P-001 §4.4 makes it what turns the corpus into a live traceability matrix, and a vector citing nothing is rejected by the linter. Each entry is a claim identifier from spec/claims.md, a conformance class from spec/conformance-classes.md, or a 'file.md#section' citation into spec/ or threat-model/. The harness checks that every entry resolves, including that the cited section exists and not merely the file.",
      "type": "array",
      "minItems": 1,
      "items": {
        "type": "string",
        "pattern": "^(Q2D-(C|NC)-[0-9]{2}|CC-[0-9]{1,2}|[a-z0-9-]+\\.md#[0-9]+(\\.[0-9]+)*)$"
      }
    },
    "description": {
      "description": "One sentence, for the reader deciding whether the vector says what it claims to. A vector nobody can review is a vector nobody can trust.",
      "type": "string",
      "minLength": 1
    },
    "operation": {
      "description": "From the closed vocabulary in P-001 §4.5, settled as one change by P-001 issue 17 so that no PRD names an operation unilaterally — four choosing separately would diverge at the *runner* level, where it surfaces as an unknown-operation error rather than a failing vector. The Stage 5-8 names are therefore present and decided rather than absent and anticipated, and an operation no runner implements yet is exit 1, which is what P-001 §7 already expects of an unbuilt stage. One name is still missing on purpose: the minimal timing capability is P-001 issue 18 and is undecided. An operation a runner does not recognise is exit 1, never a skip.",
      "type": "string",
      "enum": [
        "sign_query",
        "sign_response",
        "verify_query",
        "verify_response",
        "digest",
        "resolve_predicate",
        "effective_domain",
        "capacity_debit",
        "policy_decide",
        "evaluate_predicate",
        "process_query",
        "process_response",
        "process_sequence",
        "build_contract",
        "project_outcome",
        "retry_bytes",
        "http_exchange",
        "fingerprint",
        "resolve_identity",
        "verify_delegation",
        "escalate_poll",
        "approve"
      ]
    },
    "input": {
      "description": "Everything the operation needs, including every value that would otherwise vary: keys, nonces, issued_at, expires_at, identifiers. P-001 §4.3 — a runner that reads a clock or generates a nonce is non-conforming. May carry `verifier`, the receiver's configuration, which is ambient state a vector must supply rather than inherit — §4.3, with its shape and its defaults in RUNNER-CONTRACT.md. Not constrained here: a runner reads its input as a tree, and a schema enumerating each operation's fields would be a second definition of what the owning PRD already fixes.",
      "type": "object"
    },
    "expect": {
      "description": "What a conforming implementation produces. The harness strips this before writing the file a runner reads (P-001 §4.2). Only 'ok' and 'rejected' may be expected: 'error' is a runner-reported outcome (P-001 §6) meaning the runner faulted, and an internal error is never a passing result.",
      "type": "object",
      "oneOf": [
        {
          "description": "The operation succeeds.",
          "type": "object",
          "additionalProperties": false,
          "required": ["outcome", "output", "comparison"],
          "properties": {
            "outcome": { "const": "ok" },
            "output": {
              "description": "Any JSON value. Its shape is the operation's, not this schema's."
            },
            "comparison": {
              "description": "'bytes' where the spec requires determinism, 'semantic' where it does not. Stated per vector with no default, because a silent default is how a determinism requirement gets quietly dropped (P-001 §4.4). 'semantic' is parse-then-deep-equal and applies to unsigned material only; anything inside 'signed' compares as bytes.",
              "enum": ["bytes", "semantic"]
            }
          }
        },
        {
          "description": "The implementation rejects the input. A successful run that reports a rejection, never a runner failure (P-001 §4.1).",
          "type": "object",
          "additionalProperties": false,
          "required": ["outcome", "rejection", "comparison"],
          "properties": {
            "outcome": { "const": "rejected" },
            "rejection": {
              "description": "Both halves, because the harness checks both (P-001 §4.6). The internal reason is what an implementation records locally; the wire response is what a requester receives.",
              "type": "object",
              "additionalProperties": false,
              "required": ["internal_reason", "wire"],
              "properties": {
                "internal_reason": { "type": "string", "minLength": 1 },
                "wire": {
                  "description": "What a requester receives. For a denial that is core-model.md §5.2's response object — status, external_reason, receipt, signature — where the receipt is the reduced shape §6 defines, exactly five fields.\n\nA vector MAY assert a subset of those fields where response construction is not what it tests: a registry/ vector exercises whether a predicate evaluates and rejects correctly, and the envelope around the rejection is not its subject. A vector asserting a subset asserts nothing about the fields it omits, and `harness lint` names every partial comparison so that is visible rather than assumed.\n\ndenial/ may not, and lint rejects one that tries. Uniformity over part of a response is not uniformity: status and external_reason are both fixed by the normalized class, so a vector asserting only those compares two constants across every cause and cannot fail. §5.3 says where the leak actually hides — 'a receipt that recorded escalate for an outcome the wire made uniform would defeat Q2D-C-08 through the evidence attached to it, in the one place nobody looks for a normalization leak'. It is a lint rule rather than a schema one because it is conditional on the section, which this schema does not otherwise branch on.\n\nA receipt a vector does assert is held to §6's shape exactly — five fields, no more and no fewer. Omitting receipt entirely asserts nothing about it; asserting a four- or six-field one asserts that a conforming implementation emits it, and §6 says none does.\n\nNo denial/ vector exists in the corpus yet, and nothing now blocks one: crypto-suites.md §3 defines the protected header so a signature is producible, §5.2's field list is closed at four, and core-model.md §2.2 fixes one timestamp spelling. The rule above is in place so the first vector authored is the right shape.",
                  "type": "object",
                  "minProperties": 1
                },
                "step": {
                  "description": "The core-model.md §4 step at which rejection occurred. Optional in general, and how the ordering/ section asserts ordering without instrumenting the implementation. An integer for a numbered step, or one of the lettered steps §4's table defines -- today 5a, the header/payload declaration comparison, 9a, the rate-limit check, and 11a, the registry entry's non-schema constraints. Closed rather than patterned, for the reason the operation vocabulary is closed: a vector citing step 12b would otherwise assert an ordering the specification does not have.",
                  "oneOf": [
                    { "type": "integer", "minimum": 1, "maximum": 19 },
                    { "enum": ["5a", "9a",
                      "11a"] }
                  ]
                }
              }
            },
            "comparison": {
              "description": "As above. A normalized denial compares as bytes: P-001 §4.8's cross-vector assertion needs the wire response to be byte-identical across causes.",
              "enum": ["bytes", "semantic"]
            }
          }
        }
      ]
    }
  }
}
