{
  "id": "suite/downgrade/header-payload-key-mismatch",
  "section": "suite",
  "requirement": [
    "crypto-suites.md#3",
    "core-model.md#2.7",
    "core-model.md#5.2.1"
  ],
  "description": "A header naming one key over a payload whose `signature.key_id` names another, signed by the key the header names — so the signature verifies and only the comparison fails. The same `external_reason` as the suite mismatch above: §5.2.1 gives one value for all three structural failures, because which part disagreed is visible in the message the requester itself produced.",
  "operation": "verify_query",
  "input": {
    "envelope": {
      "signed": "eyJrZXlfaWQiOiJ0ZXN0LXJlcXVlc3Rlci0xIiwic3VpdGUiOiJlZGRzYS1qd3MtMjAyNiJ9.eyJhbnN3ZXJfY29udHJhY3QiOnsiYWxsb3dlZF9kZXRhaWxfZmllbGRzIjpbXSwiZG9tYWluIjpbZmFsc2UsdHJ1ZV0sInJlbGVhc2Vfc2hhcGUiOiJib29sZWFuIn0sImRlbGl2ZXJ5Ijp7ImFuc3dlcl9yZWNpcGllbnQiOiJkaWQ6a2V5Ono2TWtSZXF1ZXN0ZXJSdW50aW1lIiwicGVybWl0dGVkX3NpbmtzIjpbInVybjpxMmQ6c2luazptb2RlbDpsb2NhbCJdfSwiZXhwaXJlc19hdCI6IjIwMjYtMDctMzFUMDk6MDU6MDBaIiwiaXNzdWVkX2F0IjoiMjAyNi0wNy0zMVQwOTowMDowMFoiLCJub25jZSI6IlV4N2tGUTJtUzBhVnZKMWNQek40YnciLCJwcmVkaWNhdGUiOnsiaWQiOiJodHRwczovL3EyZC5kZXYvcHJlZGljYXRlcy9kaWV0YXJ5L21lbnUtY29tcGF0aWJsZSIsInB1YmxpY19jb250ZXh0Ijp7Im1lbnUiOlt7ImNvbnRhaW5zIjpbIm1pbGsiXSwiaXRlbV9pZCI6InJpc290dG8ifSx7ImNvbnRhaW5zIjpbXSwiaXRlbV9pZCI6InNhbGFkIn1dfSwicmVnaXN0cnlfZGlnZXN0Ijoic2hhMjU2OmJkMDhmZjIzMGRlMGQ4Y2UzNGRlOTk5NjdmN2E5MDk3OTg4YjQ5MDU4ZjBhMjFkZDM1Yjk0NDRjMjQwOThlMzUiLCJ2ZXJzaW9uIjoiMC4xIn0sInB1cnBvc2UiOnsiY29kZSI6InNvY2lhbC5tZWFsLXBsYW5uaW5nIiwiZGVzY3JpcHRpb24iOiJDaG9vc2UgYSBkaW5uZXIgdmVudWUgZm9yIDIwMjYtMDctMzEifSwicTJkX3ZlcnNpb24iOiIwLjEiLCJxdWVyeV9pZCI6InVybjp1dWlkOjBlMTgzMzg5LTBmMzctNGM1Zi04YzU2LTFlYTdlNTgxOGUxOCIsInJlcXVlc3RlciI6eyJhZ2VudCI6ImRpZDprZXk6ejZNa1JlcXVlc3RlckFnZW50IiwiZGVsZWdhdGlvbiI6eyJwcm9maWxlIjoibG9jYWwtcGFpcmluZy0wLjEiLCJyZWZlcmVuY2UiOiJzaGEyNTY6N2VmMSJ9LCJwcmluY2lwYWwiOiJkaWQ6a2V5Ono2TWtSZXF1ZXN0ZXJQcmluY2lwYWwifSwic2lnbmF0dXJlIjp7ImtleV9pZCI6InRlc3QtcmVxdWVzdGVyLTIiLCJwcm9maWxlIjoiZWRkc2EtandzLTIwMjYifSwidGFyZ2V0Ijp7ImN1c3RvZGlhbiI6Imh0dHBzOi8vZnJpZW5kLmV4YW1wbGUvLndlbGwta25vd24vcTJkIn0sInR5cGUiOiJxdWVyeSJ9.u-V5_C8YNuxhnLS89FlF4SQnHhelkqAMNbb1g6hJH40JDBX1aNCmuMItTUCRkQ0bFmXzhrz5sgI_VyQ2c4NjDw",
      "routing": {
        "q2d_version": "0.1",
        "type": "query",
        "target": {
          "custodian": "https://friend.example/.well-known/q2d"
        },
        "predicate": {
          "id": "https://q2d.dev/predicates/dietary/menu-compatible",
          "version": "0.1"
        },
        "expires_at": "2026-07-31T09:05:00Z"
      }
    }
  },
  "expect": {
    "outcome": "rejected",
    "rejection": {
      "internal_reason": "header_payload_key_mismatch",
      "wire": {
        "status": "deny",
        "external_reason": "structurally_invalid"
      },
      "step": "5a"
    },
    "comparison": "bytes"
  }
}
