{
  "id": "ordering/step-11a/slot-below-the-granularity-floor",
  "section": "ordering",
  "requirement": [
    "core-model.md#4",
    "core-model.md#5.2.1",
    "CC-2"
  ],
  "description": "A candidate slot of five minutes, where the `availability-window` entry sets a `minimum_slot_duration` of thirty. The entry's input schema cannot express that — a duration floor is a relation between two fields — so step 11 passes and 11a catches it. That is the whole reason 11a is a separate step: an implementation folding it into 11 would satisfy §4 by running a schema validator and stopping.",
  "operation": "process_query",
  "input": {
    "envelope": {
      "signed": "eyJrZXlfaWQiOiJ0ZXN0LXJlcXVlc3Rlci0xIiwic3VpdGUiOiJlZGRzYS1qd3MtMjAyNiJ9.eyJhbnN3ZXJfY29udHJhY3QiOnsiYWxsb3dlZF9kZXRhaWxfZmllbGRzIjpbXSwiZG9tYWluIjoicmVnaXN0ZXJlZCIsInByZWNpc2lvbiI6IlBUMzBNIiwicmVsZWFzZV9zaGFwZSI6ImludGVydmFsIn0sImRlbGl2ZXJ5Ijp7ImFuc3dlcl9yZWNpcGllbnQiOiJkaWQ6a2V5Ono2TWtSZXF1ZXN0ZXJSdW50aW1lIiwicGVybWl0dGVkX3NpbmtzIjpbInVybjpxMmQ6c2luazptb2RlbDpsb2NhbCJdfSwiZXhwaXJlc19hdCI6IjIwMjYtMDctMzFUMDk6MDU6MDBaIiwiaXNzdWVkX2F0IjoiMjAyNi0wNy0zMVQwOTowMDowMFoiLCJub25jZSI6IlV4N2tGUTJtUzBhVnZKMWNQek40YnciLCJwcmVkaWNhdGUiOnsiaWQiOiJodHRwczovL3EyZC5kZXYvcHJlZGljYXRlcy9zY2hlZHVsaW5nL2F2YWlsYWJpbGl0eS13aW5kb3ciLCJwdWJsaWNfY29udGV4dCI6eyJjYW5kaWRhdGVzIjpbeyJlbmQiOiIyMDI2LTA4LTEwVDE4OjA1OjAwWiIsInN0YXJ0IjoiMjAyNi0wOC0xMFQxODowMDowMFoifV19LCJyZWdpc3RyeV9kaWdlc3QiOiJzaGEyNTY6NmNhNDgxYTU1NWRhNjMzZmZiZDFlY2JkMzdjNzg5NzA5MWU4ZDAxYWYwMzZmZDI2MTBjNjQ2MGEyNzFkM2ZmZCIsInZlcnNpb24iOiIwLjEifSwicHVycG9zZSI6eyJjb2RlIjoic29jaWFsLm1lYWwtcGxhbm5pbmciLCJkZXNjcmlwdGlvbiI6IkNob29zZSBhIGRpbm5lciB2ZW51ZSBmb3IgMjAyNi0wNy0zMSJ9LCJxMmRfdmVyc2lvbiI6IjAuMSIsInF1ZXJ5X2lkIjoidXJuOnV1aWQ6MGUxODMzODktMGYzNy00YzVmLThjNTYtMWVhN2U1ODE4ZTE4IiwicmVxdWVzdGVyIjp7ImFnZW50IjoiZGlkOmtleTp6Nk1rUmVxdWVzdGVyQWdlbnQiLCJkZWxlZ2F0aW9uIjp7InByb2ZpbGUiOiJsb2NhbC1wYWlyaW5nLTAuMSIsInJlZmVyZW5jZSI6InNoYTI1Njo3ZWYxIn0sInByaW5jaXBhbCI6ImRpZDprZXk6ejZNa1JlcXVlc3RlclByaW5jaXBhbCJ9LCJzaWduYXR1cmUiOnsia2V5X2lkIjoidGVzdC1yZXF1ZXN0ZXItMSIsInByb2ZpbGUiOiJlZGRzYS1qd3MtMjAyNiJ9LCJ0YXJnZXQiOnsiY3VzdG9kaWFuIjoiaHR0cHM6Ly9mcmllbmQuZXhhbXBsZS8ud2VsbC1rbm93bi9xMmQifSwidHlwZSI6InF1ZXJ5In0.S5BJ9f5B6GKmhCo6P5-FR2nk4O9xQBGjCORPi2oG2xuqI6V2G2hayJcer-DnI6eqPcQ8DbSxicjhraFzkS5WBA"
    },
    "environment": {
      "now": "2026-07-31T09:01:00Z"
    }
  },
  "expect": {
    "outcome": "rejected",
    "rejection": {
      "internal_reason": "constraint_violation_minimum_slot_duration",
      "wire": {
        "status": "deny",
        "external_reason": "unavailable"
      },
      "step": "11a"
    },
    "comparison": "bytes"
  }
}
